{
  "$schema": "../Schema/control-catalog.schema.json",
  "schemaVersion": "1.0",
  "catalogVersion": "1.0.0",
  "generatedOn": "2026-07-12",
  "description": "Curated read-only Windows security posture controls for Hardening Lens. Controls are Microsoft-aligned operational checks, not a verbatim vendor baseline or certification.",
  "controls": [
    {
      "id": "HL-ACC-001",
      "title": "Built-in Guest account is disabled",
      "category": "Identity",
      "severity": "High",
      "probe": "LocalGuestAccount",
      "description": "Checks the local account identified by the well-known RID 501 rather than relying on a localized account name.",
      "rationale": "An enabled guest account provides an unnecessary logon path with weak accountability.",
      "remediation": "Disable the built-in Guest account through Group Policy, Intune, or local security policy and verify that no application depends on it.",
      "parameters": {},
      "references": [
        "https://learn.microsoft.com/windows/security/operating-system-security/device-management/windows-security-configuration-framework/windows-security-baselines"
      ],
      "tags": [
        "account",
        "local-security"
      ]
    },
    {
      "id": "HL-UAC-001",
      "title": "User Account Control is enabled",
      "category": "Privilege Management",
      "severity": "Critical",
      "probe": "RegistryValue",
      "description": "Verifies that all administrators run in Admin Approval Mode.",
      "rationale": "Disabling UAC removes an important privilege boundary and weakens multiple Windows security features.",
      "remediation": "Set \"User Account Control: Run all administrators in Admin Approval Mode\" to Enabled and restart the device.",
      "parameters": {
        "path": "HKLM:\\SOFTWARE\\Microsoft\\Windows\\CurrentVersion\\Policies\\System",
        "name": "EnableLUA",
        "operator": "Equals",
        "expected": 1
      },
      "references": [
        "https://learn.microsoft.com/windows/security/application-security/application-control/user-account-control/settings-and-configuration"
      ],
      "tags": [
        "uac",
        "privilege"
      ]
    },
    {
      "id": "HL-UAC-002",
      "title": "Administrator elevation prompts require consent",
      "category": "Privilege Management",
      "severity": "High",
      "probe": "RegistryValue",
      "description": "Checks that administrator elevation is not configured to occur silently.",
      "rationale": "Silent elevation makes malicious or accidental privileged execution harder to detect and contain.",
      "remediation": "Configure the administrator elevation prompt to \"Prompt for consent for non-Windows binaries\" or a stricter credential prompt.",
      "parameters": {
        "path": "HKLM:\\SOFTWARE\\Microsoft\\Windows\\CurrentVersion\\Policies\\System",
        "name": "ConsentPromptBehaviorAdmin",
        "operator": "In",
        "expected": [
          1,
          2,
          3,
          4,
          5
        ]
      },
      "references": [
        "https://learn.microsoft.com/windows/security/application-security/application-control/user-account-control/settings-and-configuration"
      ],
      "tags": [
        "uac",
        "privilege"
      ]
    },
    {
      "id": "HL-UAC-003",
      "title": "Built-in Administrator uses Admin Approval Mode",
      "category": "Privilege Management",
      "severity": "Medium",
      "probe": "RegistryValue",
      "description": "Checks Admin Approval Mode for the built-in Administrator account.",
      "rationale": "The built-in Administrator otherwise runs with a full token without UAC consent.",
      "remediation": "Set \"User Account Control: Admin Approval Mode for the Built-in Administrator account\" to Enabled.",
      "parameters": {
        "path": "HKLM:\\SOFTWARE\\Microsoft\\Windows\\CurrentVersion\\Policies\\System",
        "name": "FilterAdministratorToken",
        "operator": "Equals",
        "expected": 1
      },
      "references": [
        "https://learn.microsoft.com/windows/security/application-security/application-control/user-account-control/settings-and-configuration"
      ],
      "tags": [
        "uac",
        "privilege"
      ]
    },
    {
      "id": "HL-LSA-001",
      "title": "LSA protection is enabled",
      "category": "Credential Protection",
      "severity": "High",
      "probe": "RegistryValue",
      "description": "Checks whether LSASS is configured to run as a protected process.",
      "rationale": "LSA protection raises the bar for credential theft and blocks untrusted code from loading into LSASS.",
      "remediation": "Enable \"Configure LSASS to run as a protected process\" in policy. Test authentication and security software compatibility before broad enforcement.",
      "parameters": {
        "path": "HKLM:\\SYSTEM\\CurrentControlSet\\Control\\Lsa",
        "name": "RunAsPPL",
        "operator": "In",
        "expected": [
          1,
          2
        ]
      },
      "references": [
        "https://learn.microsoft.com/windows-server/security/credentials-protection-and-management/configuring-additional-lsa-protection"
      ],
      "tags": [
        "lsa",
        "credentials"
      ]
    },
    {
      "id": "HL-CRED-001",
      "title": "WDigest credential caching is disabled",
      "category": "Credential Protection",
      "severity": "High",
      "probe": "RegistryValue",
      "description": "Checks that WDigest does not retain reusable plaintext credentials in LSASS.",
      "rationale": "Enabling WDigest credential caching can expose plaintext credentials to memory-access attacks.",
      "remediation": "Set UseLogonCredential to 0 under the WDigest security provider policy. A missing value is treated as the secure modern default.",
      "parameters": {
        "path": "HKLM:\\SYSTEM\\CurrentControlSet\\Control\\SecurityProviders\\WDigest",
        "name": "UseLogonCredential",
        "operator": "Equals",
        "expected": 0,
        "missingIsPass": true
      },
      "references": [
        "https://learn.microsoft.com/windows/security/operating-system-security/device-management/windows-security-configuration-framework/windows-security-baselines"
      ],
      "tags": [
        "wdigest",
        "credentials"
      ]
    },
    {
      "id": "HL-CRED-002",
      "title": "Credential Guard is running",
      "category": "Credential Protection",
      "severity": "High",
      "probe": "CredentialGuard",
      "description": "Queries the Windows Device Guard provider and verifies that Credential Guard is active, not merely configured.",
      "rationale": "Credential Guard uses virtualization-based security to isolate secrets from the normal operating system.",
      "remediation": "Enable virtualization-based security and Credential Guard with the deployment mode appropriate for the device. Validate VPN, Wi-Fi, delegation, and legacy authentication dependencies first.",
      "parameters": {},
      "references": [
        "https://learn.microsoft.com/windows/security/identity-protection/credential-guard/configure"
      ],
      "tags": [
        "credential-guard",
        "vbs"
      ]
    },
    {
      "id": "HL-LAPS-001",
      "title": "Windows LAPS password backup is configured",
      "category": "Credential Protection",
      "severity": "High",
      "probe": "LapsBackup",
      "description": "Evaluates the active Windows LAPS policy root and verifies that password backup targets Microsoft Entra ID or Active Directory.",
      "rationale": "Unique, rotated local administrator passwords reduce lateral movement and shared-password risk.",
      "remediation": "Configure Windows LAPS BackupDirectory through Intune CSP or Group Policy and validate permissions to retrieve passwords.",
      "parameters": {},
      "references": [
        "https://learn.microsoft.com/windows-server/identity/laps/laps-management-policy-settings"
      ],
      "tags": [
        "laps",
        "local-admin"
      ]
    },
    {
      "id": "HL-LAPS-002",
      "title": "Windows LAPS password age is 30 days or less",
      "category": "Credential Protection",
      "severity": "Medium",
      "probe": "LapsPasswordAge",
      "description": "Evaluates the effective PasswordAgeDays value from the active Windows LAPS policy root.",
      "rationale": "Regular rotation limits the useful lifetime of a disclosed local administrator password.",
      "remediation": "Configure PasswordAgeDays to 30 or fewer days, balancing rotation with operational recovery requirements.",
      "parameters": {
        "maximumDays": 30
      },
      "references": [
        "https://learn.microsoft.com/windows-server/identity/laps/laps-management-policy-settings"
      ],
      "tags": [
        "laps",
        "rotation"
      ]
    },
    {
      "id": "HL-LAPS-003",
      "title": "Windows LAPS AD password encryption is enabled",
      "category": "Credential Protection",
      "severity": "High",
      "probe": "LapsAdEncryption",
      "description": "When LAPS backs up to Active Directory, verifies that password encryption is enabled. Entra-backed devices are marked not applicable.",
      "rationale": "AD password encryption narrows exposure of stored LAPS secrets and enables stronger authorization controls.",
      "remediation": "Enable ADPasswordEncryptionEnabled for Active Directory-backed Windows LAPS after confirming the domain functional level and authorized decryptors.",
      "parameters": {},
      "references": [
        "https://learn.microsoft.com/windows-server/identity/laps/laps-management-policy-settings"
      ],
      "tags": [
        "laps",
        "active-directory"
      ]
    },
    {
      "id": "HL-ANON-001",
      "title": "Anonymous SAM enumeration is restricted",
      "category": "Identity",
      "severity": "High",
      "probe": "RegistryValue",